{"type":"config","name":"Ora LLM Time-to-First-Token Optimization (qwen3-4b)","metricName":"avg_ttft_ms","metricUnit":"ms","bestDirection":"lower"}
{"run":1,"commit":"e17344e","metric":1578.4,"metrics":{"min_ttft_ms":1554,"max_ttft_ms":2012,"pass_rate":0.5,"prompt_chars":9785},"status":"keep","description":"Baseline: original system-prompt.txt (~9785 chars, ~2935 est tokens). avg_ttft=1578ms, pass=17/34","timestamp":1773677806329,"segment":0}
{"run":2,"commit":"0b94e37","metric":397.9,"metrics":{"max_ttft_ms":706,"min_ttft_ms":325,"pass_rate":0.706,"prompt_chars":1417},"status":"keep","description":"Compact prompt (1417 chars) + fix tool schema injection ({{core_tools}} resolved). Removed Notes/Messages/Mail/Research/Skills sections. TTFT -75%, pass_rate +41%","timestamp":1773678145932,"segment":0}
{"run":3,"commit":"0b94e37","metric":419.1,"metrics":{"max_ttft_ms":676,"min_ttft_ms":369,"pass_rate":0.735,"prompt_chars":1549},"status":"discard","description":"Strengthened proposal rule with CRITICAL note. pass_rate 0.706→0.735 but TTFT 398→419ms (extra text). Discarding.","timestamp":1773678376094,"segment":0}
{"run":4,"commit":"40cdd0d","metric":324.5,"metrics":{"max_ttft_ms":911,"min_ttft_ms":249,"pass_rate":0.618,"prompt_chars":893},"status":"keep","description":"Ultra-compact prompt (893 chars). TTFT 398→324ms (-18% from prev best). pass_rate dropped 0.706→0.618 — less explicit proposal rule hurts accuracy","timestamp":1773678590849,"segment":0}
{"run":5,"commit":"40cdd0d","metric":364.2,"metrics":{"max_ttft_ms":1430,"min_ttft_ms":268,"pass_rate":0.647,"prompt_chars":1001},"status":"discard","description":"Added system action guidance. TTFT 324→364ms (+40ms worse). pass_rate 0.618→0.647 (only +1 test). Bad tradeoff. Discard.","timestamp":1773678809917,"segment":0}
{"run":6,"commit":"f4ecac7","metric":319.7,"metrics":{"max_ttft_ms":574,"min_ttft_ms":272,"pass_rate":0.765,"prompt_chars":941},"status":"keep","description":"Added 'Only use when no applicable tool exists.' constraint to direct answer. TTFT 324→320ms AND pass_rate 0.618→0.765. Win on both metrics.","timestamp":1773678982071,"segment":0}
{"run":7,"commit":"f4ecac7","metric":339.8,"metrics":{"max_ttft_ms":597,"min_ttft_ms":270,"pass_rate":0.735,"prompt_chars":1011},"status":"discard","description":"Added tool_call examples (open app, search, etc.). TTFT 320→340ms + pass_rate 0.765→0.735. Both worse. Discard.","timestamp":1773679253365,"segment":0}
{"run":8,"commit":"3caeb2f","metric":638.9,"metrics":{"max_ttft_ms":882,"min_ttft_ms":570,"pass_rate":0.647,"prompt_chars":2983},"status":"keep","description":"Option B hybrid: compact output rules + all domain sections trimmed (Notes/Mail/Messages/System/Skills). 2983 chars. TTFT 1578→639ms (-60%), pass_rate 0.647 (22/34). Production-safe merge target.","timestamp":1773680514013,"segment":0}
{"run":9,"commit":"59f0dbc","metric":724.6,"metrics":{"max_ttft_ms":1745,"min_ttft_ms":636,"pass_rate":0.706,"prompt_chars":3344},"status":"keep","description":"Baseline: merged hybrid prompt (3344 chars). avg_ttft=724ms, pass_rate=0.706 (24/34). Starting continuation session.","timestamp":1773684728226,"segment":0}
{"run":10,"commit":"59f0dbc","metric":520,"metrics":{"max_ttft_ms":801,"min_ttft_ms":466,"pass_rate":0.441,"prompt_chars":2263},"status":"discard","description":"Over-compressed all sections — 'Tool call:' terse label + SYSTEM over-proposal hint broke both directions. 520ms but 15/34 pass (0.441). Discard.","timestamp":1773685045958,"segment":0}
{"run":11,"commit":"fdb5b0f","metric":518.7,"metrics":{"max_ttft_ms":804,"min_ttft_ms":465,"pass_rate":0.706,"prompt_chars":2237},"status":"keep","description":"Compact production prompt (2237 chars): exact 941-char OUTPUT FORMAT + 1-line domain sections + RESEARCH + deferred catalog vars. TTFT 724→519ms (-28%), pass_rate stable at 0.706.","timestamp":1773685228424,"segment":0}
{"run":12,"commit":"d58eed8","metric":521.3,"metrics":{"max_ttft_ms":804,"min_ttft_ms":467,"pass_rate":0.824,"prompt_chars":2258},"status":"keep","description":"Added 'Never claim to perform an action without calling a tool' constraint. pass_rate 0.706→0.824 (+12pp, 24→28 tests). TTFT 519→521ms (2ms noise). Memory moved to intro sentence.","timestamp":1773685443958,"segment":0}
{"run":13,"commit":"d58eed8","metric":521.7,"metrics":{"max_ttft_ms":804,"min_ttft_ms":468,"pass_rate":0.794,"prompt_chars":2258},"status":"discard","description":"temperature=0 (greedy). TTFT unchanged (521ms, as expected — TTFT is prefill-only). pass_rate 0.824→0.794. No benefit. Reverted temperature to 0.7.","timestamp":1773685768011,"segment":0}
{"run":14,"commit":"c96c54c","metric":460.5,"metrics":{"max_ttft_ms":725,"min_ttft_ms":388,"pass_rate":0.765,"prompt_chars":1858},"status":"keep","description":"Aggressive compression: compact intro, removed ISO from CONTEXT, RULES→1 line, tighter domain sections. 1858 chars. TTFT 521→460ms (-12%), pass_rate 0.824→0.765 (still ≥0.75).","timestamp":1773685956260,"segment":0}
{"run":15,"commit":"a3abf74","metric":458,"metrics":{"max_ttft_ms":729,"min_ttft_ms":388,"pass_rate":0.765,"prompt_chars":1865},"status":"keep","description":"Restored 'You are Ora' persona format. Fixed calendar-query/contacts-search 'error' cases from prev run. TTFT 460→458ms (noise). pass_rate 0.765 stable.","timestamp":1773686156942,"segment":0}
{"run":16,"commit":"d56018d","metric":448.4,"metrics":{"max_ttft_ms":640,"min_ttft_ms":397,"pass_rate":0.882,"prompt_chars":1865},"status":"keep","description":"Tool schemas: show only required params (drop ':str' type + omit optionals). TTFT 458→448ms AND pass_rate 0.765→0.882 (26→30 tests). Double win.","timestamp":1773686371283,"segment":0}
{"run":17,"commit":"d56018d","metric":438.9,"metrics":{"max_ttft_ms":645,"min_ttft_ms":400,"pass_rate":0.618,"prompt_chars":1778},"status":"discard","description":"Multiple simultaneous changes. Pass_rate crashed 0.882→0.618. Likely intro removed capability list ('calendar, reminders, contacts...'). 439ms TTFT but unacceptable accuracy. Discard.","timestamp":1773686645245,"segment":0}
{"run":18,"commit":"d56018d","metric":445.8,"metrics":{"max_ttft_ms":624,"min_ttft_ms":388,"pass_rate":0.794,"prompt_chars":1865},"status":"discard","description":"30-char desc cap: TTFT 448→446ms (noise), pass_rate 0.882→0.794. Shorter descriptions hurt accuracy. Now trying no-description schema: name + required params only.","timestamp":1773686905133,"segment":0}
{"run":19,"commit":"96fc41b","metric":434,"metrics":{"max_ttft_ms":520,"min_ttft_ms":401,"pass_rate":0.794,"prompt_chars":1865},"status":"keep","description":"No descriptions in tool schemas (name + required params only). TTFT 448→434ms (-3%), max_ttft 640→520ms. pass_rate 0.882→0.794 (still ≥0.75). Descriptions were adding noise.","timestamp":1773687062246,"segment":0}
{"run":20,"commit":"96fc41b","metric":434,"metrics":{"max_ttft_ms":520,"min_ttft_ms":401,"pass_rate":0.794,"prompt_chars":1865},"status":"discard","description":"No-description schema: open_settings/open_app got JSON errors without 'Open System Settings to...' context. 3 new failures. Reverting to 52-char desc + required-params-only (the run #16 sweet spot).","timestamp":1773687129457,"segment":0}
{"run":21,"commit":"35c0661","metric":446.1,"metrics":{"max_ttft_ms":674,"min_ttft_ms":383,"pass_rate":0.824,"prompt_chars":1900},"status":"keep","description":"Production SystemPromptBuilder updated to required-params-only encoding. ISO restored to CONTEXT. Tests updated. TTFT 448→446ms, pass_rate 0.882→0.824 (variance at temp=0.7, still >0.75).","timestamp":1773688097062,"segment":0}
{"type":"config","name":"Ora LLM Time-to-First-Token Optimization (qwen3-4b) — session 3","metricName":"avg_ttft_ms","metricUnit":"ms","bestDirection":"lower"}
{"run":1,"commit":"68799c7","metric":446.2,"metrics":{"max_ttft_ms":643,"min_ttft_ms":386,"pass_rate":0.853,"prompt_chars":1770},"status":"keep","description":"Session 3 baseline: removed DYNAMIC TOOLS + DEFERRED CATALOG header from static prompt (moved into encodeDeferredToolCatalog, only shown when catalog non-empty). TTFT same, pass_rate 0.824→0.853 (+3pp). Blank-line cleanup in template.","timestamp":1773690001021,"segment":0}
{"run":2,"commit":"486b0d6","metric":433.5,"metrics":{"max_ttft_ms":1236,"min_ttft_ms":367,"pass_rate":0.882,"prompt_chars":1580},"status":"keep","description":"Compressed RULES (removed ISO example -47 chars) + RESEARCH (compacted -68 chars). TTFT -12.7ms, pass_rate 0.853→0.882. Double win.","timestamp":1773690563398,"segment":0}
{"run":3,"commit":"f6a8e27","metric":404.4,"metrics":{"max_ttft_ms":600,"min_ttft_ms":366,"pass_rate":0.941,"prompt_chars":1527},"status":"keep","description":"NOTES compressed + OUTPUT FORMAT examples use '...' placeholders. TTFT -29ms (-6.7%), pass_rate 0.882→0.941. Best result ever. max_ttft 1236→600ms.","timestamp":1773690781200,"segment":0}
{"run":4,"commit":"9f877c4","metric":399.8,"metrics":{"max_ttft_ms":597,"min_ttft_ms":348,"pass_rate":0.912,"prompt_chars":1508},"status":"keep","description":"Compact JSON in OUTPUT FORMAT (no spaces). TTFT 404.4→399.8ms — first time sub-400ms! pass_rate 0.912 (small drop vs 0.941, within variance, >0.75).","timestamp":1773691093712,"segment":0}
{"run":5,"commit":"9f877c4","metric":399.4,"metrics":{"max_ttft_ms":594,"min_ttft_ms":349,"pass_rate":0.912,"prompt_chars":1508},"status":"discard","description":"Re-run confirms 399.4ms, 0.912 stable (same 3 failures). Now trying: restore spaces in JSON examples to fix calendar.create_event + remove redundant 'Remember: JSON only.' to compensate.","timestamp":1773691319128,"segment":0}
{"run":6,"commit":"9f877c4","metric":406.7,"metrics":{"max_ttft_ms":595,"min_ttft_ms":366,"pass_rate":0.765,"prompt_chars":1527},"status":"discard","description":"Removing 'Remember: JSON only.' caused catastrophic pass_rate crash 0.941→0.765. That line is critical reinforcement. Discard. Trying spaces+shorter header instead.","timestamp":1773691499587,"segment":0}
{"run":7,"commit":"9f877c4","metric":402.3,"metrics":{"max_ttft_ms":595,"min_ttft_ms":369,"pass_rate":0.912,"prompt_chars":1513},"status":"discard","description":"Spaces + shorter header: calendar.create_event still failing. The failure is independent of JSON spacing. TTFT 402.3ms, still 0.912. Discard — compact JSON run #4 remains best.","timestamp":1773691695719,"segment":0}
{"run":8,"commit":"9f877c4","metric":436.8,"metrics":{"max_ttft_ms":1335,"min_ttft_ms":367,"pass_rate":0.882,"prompt_chars":1520},"status":"discard","description":"Spaces + shorter SKILLS line: new failures (open_folder_special, reminders.edit). TTFT 436ms + outlier 1335ms. Worse on both metrics. Discard — run #4 (compact JSON, 399.8ms) remains best.","timestamp":1773692931227,"segment":0}
{"run":9,"commit":"9f877c4","metric":393.7,"metrics":{"max_ttft_ms":574,"min_ttft_ms":351,"pass_rate":0.853,"prompt_chars":1484},"status":"discard","description":"Shorter header 'OUTPUT FORMAT (JSON only):' dropped pass_rate 0.912→0.853. 'no prose outside JSON' constraint prevents prose-before-JSON failures (reveal_in_finder, list_apps). Discard.","timestamp":1773693137345,"segment":0}
{"run":10,"commit":"9f877c4","metric":404.1,"metrics":{"max_ttft_ms":599,"min_ttft_ms":353,"pass_rate":0.882,"prompt_chars":1508},"status":"discard","description":"applyChatTemplate: TTFT 399.8→404ms (+4ms), pass_rate 0.912→0.882. Manual ChatML encoding was already optimal. Tool role mapped to user — changes conversation structure. Discard.","timestamp":1773693428420,"segment":0}
{"run":11,"commit":"9f877c4","metric":404,"metrics":{"max_ttft_ms":598,"min_ttft_ms":355,"pass_rate":0.882,"prompt_chars":1508},"status":"discard","description":"Verification run — no code changes. 404ms TTFT vs 399.8ms (run #4), 0.882 vs 0.912 pass_rate. Pure temperature=0.7 variance (±5ms TTFT, ±3pp pass_rate). Steady state confirmed ~400-406ms.","timestamp":1773693607516,"segment":0}
